{
  "schema_version": "1.1",
  "generated_at": "2026-06-15T19:16:14.822385+00:00",
  "root": ".",
  "flows": [
    {
      "id": "flow-1c6b6f96cffc422d",
      "name": "delete_user",
      "symbol": "backend.api.admin_routes:delete_user",
      "language": "python",
      "framework": "generic",
      "entry_kind": "function",
      "is_entrypoint": true,
      "location": {
        "path": "backend/api/admin_routes.py",
        "start_line": 7,
        "end_line": 10
      },
      "nodes": [
        {
          "id": "flow-1c6b6f96cffc422d:n1",
          "kind": "entry",
          "label": "delete_user",
          "location": {
            "path": "backend/api/admin_routes.py",
            "start_line": 7,
            "end_line": 10
          },
          "evidence": "VERIFIED",
          "detail": "",
          "metadata": {
            "symbol": "backend.api.admin_routes:delete_user",
            "reachable_from_entry": true,
            "reaches_terminal": true
          }
        },
        {
          "id": "flow-1c6b6f96cffc422d:n2",
          "kind": "action",
          "label": "'Control: gated on the ADMIN role before the destructive action.'",
          "location": {
            "path": "backend/api/admin_routes.py",
            "start_line": 8,
            "end_line": 8
          },
          "evidence": "VERIFIED",
          "detail": "\"\"\"Control: gated on the ADMIN role before the destructive action.\"\"\"",
          "metadata": {
            "reachable_from_entry": true,
            "reaches_terminal": true
          }
        },
        {
          "id": "flow-1c6b6f96cffc422d:n3",
          "kind": "call",
          "label": "Call require_role()",
          "location": {
            "path": "backend/api/admin_routes.py",
            "start_line": 9,
            "end_line": 9
          },
          "evidence": "VERIFIED",
          "detail": "require_role(admin, Role.ADMIN)",
          "metadata": {
            "calls": [
              "require_role"
            ],
            "reachable_from_entry": true,
            "reaches_terminal": true,
            "qualified_calls": [
              "backend.auth:require_role"
            ],
            "effects": [
              "auth_check"
            ],
            "link_confidence": "high",
            "call_candidates": [
              "flow-e09895754a5d776e"
            ],
            "target_flow": "flow-e09895754a5d776e",
            "target_symbol": "backend.auth:require_role"
          }
        },
        {
          "id": "flow-1c6b6f96cffc422d:n4",
          "kind": "call",
          "label": "Call do_delete()",
          "location": {
            "path": "backend/api/admin_routes.py",
            "start_line": 10,
            "end_line": 10
          },
          "evidence": "VERIFIED",
          "detail": "do_delete(target)",
          "metadata": {
            "calls": [
              "do_delete"
            ],
            "reachable_from_entry": true,
            "reaches_terminal": true,
            "qualified_calls": [
              "backend.api.admin_routes:do_delete"
            ],
            "effects": [
              "db_write"
            ]
          }
        },
        {
          "id": "flow-1c6b6f96cffc422d:n5",
          "kind": "terminal",
          "label": "Complete",
          "location": {
            "path": "backend/api/admin_routes.py",
            "start_line": 7,
            "end_line": 10
          },
          "evidence": "INFERRED",
          "detail": "",
          "metadata": {
            "reachable_from_entry": true,
            "reaches_terminal": true
          }
        }
      ],
      "edges": [
        {
          "id": "flow-1c6b6f96cffc422d:e1",
          "source": "flow-1c6b6f96cffc422d:n1",
          "target": "flow-1c6b6f96cffc422d:n2",
          "label": "",
          "evidence": "VERIFIED"
        },
        {
          "id": "flow-1c6b6f96cffc422d:e2",
          "source": "flow-1c6b6f96cffc422d:n2",
          "target": "flow-1c6b6f96cffc422d:n3",
          "label": "",
          "evidence": "VERIFIED"
        },
        {
          "id": "flow-1c6b6f96cffc422d:e3",
          "source": "flow-1c6b6f96cffc422d:n3",
          "target": "flow-1c6b6f96cffc422d:n4",
          "label": "",
          "evidence": "VERIFIED"
        },
        {
          "id": "flow-1c6b6f96cffc422d:e4",
          "source": "flow-1c6b6f96cffc422d:n4",
          "target": "flow-1c6b6f96cffc422d:n5",
          "label": "",
          "evidence": "VERIFIED"
        }
      ],
      "calls": [
        "flow-e09895754a5d776e"
      ],
      "called_by": [],
      "tests": [],
      "metadata": {
        "async": false,
        "test": false,
        "decorators": [],
        "performs_auth_check": true
      }
    },
    {
      "id": "flow-10ef2d061b27b88c",
      "name": "purge_user",
      "symbol": "backend.api.admin_routes:purge_user",
      "language": "python",
      "framework": "generic",
      "entry_kind": "function",
      "is_entrypoint": true,
      "location": {
        "path": "backend/api/admin_routes.py",
        "start_line": 13,
        "end_line": 15
      },
      "nodes": [
        {
          "id": "flow-10ef2d061b27b88c:n1",
          "kind": "entry",
          "label": "purge_user",
          "location": {
            "path": "backend/api/admin_routes.py",
            "start_line": 13,
            "end_line": 15
          },
          "evidence": "VERIFIED",
          "detail": "",
          "metadata": {
            "symbol": "backend.api.admin_routes:purge_user",
            "reachable_from_entry": true,
            "reaches_terminal": true
          }
        },
        {
          "id": "flow-10ef2d061b27b88c:n2",
          "kind": "action",
          "label": "'Planted #12: the require_role gate its sibling delete_user has is missing.'",
          "location": {
            "path": "backend/api/admin_routes.py",
            "start_line": 14,
            "end_line": 14
          },
          "evidence": "VERIFIED",
          "detail": "\"\"\"Planted #12: the require_role gate its sibling delete_user has is missing.\"\"\"",
          "metadata": {
            "reachable_from_entry": true,
            "reaches_terminal": true
          }
        },
        {
          "id": "flow-10ef2d061b27b88c:n3",
          "kind": "call",
          "label": "Call do_purge()",
          "location": {
            "path": "backend/api/admin_routes.py",
            "start_line": 15,
            "end_line": 15
          },
          "evidence": "VERIFIED",
          "detail": "do_purge(target)",
          "metadata": {
            "calls": [
              "do_purge"
            ],
            "reachable_from_entry": true,
            "reaches_terminal": true,
            "qualified_calls": [
              "backend.api.admin_routes:do_purge"
            ]
          }
        },
        {
          "id": "flow-10ef2d061b27b88c:n4",
          "kind": "terminal",
          "label": "Complete",
          "location": {
            "path": "backend/api/admin_routes.py",
            "start_line": 13,
            "end_line": 15
          },
          "evidence": "INFERRED",
          "detail": "",
          "metadata": {
            "reachable_from_entry": true,
            "reaches_terminal": true
          }
        }
      ],
      "edges": [
        {
          "id": "flow-10ef2d061b27b88c:e1",
          "source": "flow-10ef2d061b27b88c:n1",
          "target": "flow-10ef2d061b27b88c:n2",
          "label": "",
          "evidence": "VERIFIED"
        },
        {
          "id": "flow-10ef2d061b27b88c:e2",
          "source": "flow-10ef2d061b27b88c:n2",
          "target": "flow-10ef2d061b27b88c:n3",
          "label": "",
          "evidence": "VERIFIED"
        },
        {
          "id": "flow-10ef2d061b27b88c:e3",
          "source": "flow-10ef2d061b27b88c:n3",
          "target": "flow-10ef2d061b27b88c:n4",
          "label": "",
          "evidence": "VERIFIED"
        }
      ],
      "calls": [],
      "called_by": [],
      "tests": [],
      "metadata": {
        "async": false,
        "test": false,
        "decorators": [],
        "performs_auth_check": false
      }
    },
    {
      "id": "flow-cd39f6aa851ac8f1",
      "name": "cancel",
      "symbol": "backend.api.orders_routes:cancel",
      "language": "python",
      "framework": "generic",
      "entry_kind": "function",
      "is_entrypoint": true,
      "location": {
        "path": "backend/api/orders_routes.py",
        "start_line": 6,
        "end_line": 10
      },
      "nodes": [
        {
          "id": "flow-cd39f6aa851ac8f1:n1",
          "kind": "entry",
          "label": "cancel",
          "location": {
            "path": "backend/api/orders_routes.py",
            "start_line": 6,
            "end_line": 10
          },
          "evidence": "VERIFIED",
          "detail": "",
          "metadata": {
            "symbol": "backend.api.orders_routes:cancel",
            "reachable_from_entry": true,
            "reaches_terminal": true
          }
        },
        {
          "id": "flow-cd39f6aa851ac8f1:n2",
          "kind": "action",
          "label": "'Refundable set {PLACED, PAID}; rejects with 404 — sibling of request_refund.'",
          "location": {
            "path": "backend/api/orders_routes.py",
            "start_line": 7,
            "end_line": 7
          },
          "evidence": "VERIFIED",
          "detail": "\"\"\"Refundable set {PLACED, PAID}; rejects with 404 — sibling of request_refund.\"\"\"",
          "metadata": {
            "reachable_from_entry": true,
            "reaches_terminal": true
          }
        },
        {
          "id": "flow-cd39f6aa851ac8f1:n3",
          "kind": "decision",
          "label": "order.status not in (OrderStatus.PLACED, OrderStatus.PAID)",
          "location": {
            "path": "backend/api/orders_routes.py",
            "start_line": 8,